{
  "$schema": "https://systems-phd-explorer.local/schemas/v1/paper-metadata.schema.json",
  "schema_version": "1.0.0",
  "paper_id": "usenix-security-2025-tracking-the-takes-and-trajectories-of-english-language-3750c023",
  "title": "Tracking the Takes and Trajectories of English-Language News Narratives across Trustworthy and Worrisome Websites",
  "venue": "usenix-security",
  "year": 2025,
  "track_or_session": "Social Issues and Security",
  "paper_type": "main-track",
  "publication_date": "2025-08-13",
  "page_count": 20,
  "venue_year_completion_status": "COMPLETE_PROCEEDINGS",
  "authors": [
    {
      "author_id": null,
      "name": "Hans W. A. Hanley",
      "position": 1,
      "orcid": null,
      "affiliations": [
        {
          "institution_id": null,
          "name_as_published": "Stanford University",
          "normalized_name": null,
          "institution_type": "unknown",
          "city": null,
          "state_or_province": null,
          "country": null,
          "region": null,
          "source_ids": [
            "src-c539a816db177a1b-paper"
          ]
        }
      ]
    },
    {
      "author_id": null,
      "name": "Emily Okabe",
      "position": 2,
      "orcid": null,
      "affiliations": [
        {
          "institution_id": null,
          "name_as_published": "Stanford University",
          "normalized_name": null,
          "institution_type": "unknown",
          "city": null,
          "state_or_province": null,
          "country": null,
          "region": null,
          "source_ids": [
            "src-c539a816db177a1b-paper"
          ]
        }
      ]
    },
    {
      "author_id": null,
      "name": "Zakir Durumeric",
      "position": 3,
      "orcid": null,
      "affiliations": [
        {
          "institution_id": null,
          "name_as_published": "Stanford University",
          "normalized_name": null,
          "institution_type": "unknown",
          "city": null,
          "state_or_province": null,
          "country": null,
          "region": null,
          "source_ids": [
            "src-c539a816db177a1b-paper"
          ]
        }
      ]
    }
  ],
  "links": {
    "doi": null,
    "official_page": "https://www.usenix.org/conference/usenixsecurity25/presentation/hanley",
    "official_pdf": "https://www.usenix.org/system/files/usenixsecurity25-hanley.pdf",
    "artifact": null,
    "code": null,
    "project": null,
    "slides": null,
    "video": null,
    "bibtex": "@inproceedings {307880,\nauthor = {Hans W. A. Hanley and Emily Okabe and Zakir Durumeric},\ntitle = {Tracking the Takes and Trajectories of {English-Language} News Narratives across Trustworthy and Worrisome Websites},\nbooktitle = {34th USENIX Security Symposium (USENIX Security 25)},\nyear = {2025},\nisbn = {978-1-939133-52-6},\naddress = {Seattle, WA},\npages = {5111--5130},\nurl = {https://www.usenix.org/conference/usenixsecurity25/presentation/hanley},\npublisher = {USENIX Association},\nmonth = aug\n}"
  },
  "alternate_versions": [],
  "sources": [
    {
      "id": "src-33742ccc2e83a509-program",
      "url": "https://www.usenix.org/conference/usenixsecurity25/technical-sessions",
      "kind": "conference-program",
      "title": "USENIX Security 2025 Technical Sessions",
      "publisher": "USENIX Association",
      "retrieved_at": "2026-07-29T23:46:51Z",
      "content_hash": null,
      "official": true,
      "supports": [
        "main-track program membership and session"
      ]
    },
    {
      "id": "src-c539a816db177a1b-paper",
      "url": "https://www.usenix.org/conference/usenixsecurity25/presentation/hanley",
      "kind": "paper-page",
      "title": "Tracking the Takes and Trajectories of English-Language News Narratives across Trustworthy and Worrisome Websites",
      "publisher": "USENIX Association",
      "retrieved_at": "2026-07-29T23:46:51Z",
      "content_hash": null,
      "official": true,
      "supports": [
        "authors, affiliations, abstract, page span, PDF, and BibTeX"
      ]
    }
  ],
  "workflow": {
    "status": "READY_FOR_REVIEW",
    "owner": "agent-d",
    "updated_at": "2026-07-29T23:46:51Z",
    "notes": [
      "Canonical conference metadata collected from the official program and publisher or paper page."
    ]
  },
  "verification": {
    "collected_at": "2026-07-29T23:46:51Z",
    "last_verified_at": "2026-07-29T23:46:51Z",
    "collector_version": "agent-d-security-collector/1.0",
    "confidence": "HIGH",
    "verified_by": "agent-d",
    "unresolved_fields": []
  }
}
