{
  "$schema": "https://systems-phd-explorer.local/schemas/v1/paper-metadata.schema.json",
  "schema_version": "1.0.0",
  "paper_id": "eurosys-2023-effective-performance-issue-diagnosis-with-value-assiste-3c331022",
  "title": "Effective Performance Issue Diagnosis with Value-Assisted Cost Profiling",
  "venue": "eurosys",
  "year": 2023,
  "track_or_session": null,
  "paper_type": "main-track",
  "publication_date": "2023-05-08",
  "page_count": 17,
  "venue_year_completion_status": "COMPLETE_PROCEEDINGS",
  "authors": [
    {
      "author_id": null,
      "name": "Lingmei Weng",
      "position": 1,
      "orcid": "0009-0006-7782-9118",
      "affiliations": [
        {
          "institution_id": null,
          "name_as_published": "Columbia University",
          "normalized_name": null,
          "institution_type": "university",
          "city": null,
          "state_or_province": null,
          "country": null,
          "region": null,
          "source_ids": [
            "src-eurosys-2023-program"
          ]
        }
      ]
    },
    {
      "author_id": null,
      "name": "Yigong Hu",
      "position": 2,
      "orcid": "0009-0003-8096-7077",
      "affiliations": [
        {
          "institution_id": null,
          "name_as_published": "Johns Hopkins University",
          "normalized_name": null,
          "institution_type": "university",
          "city": null,
          "state_or_province": null,
          "country": null,
          "region": null,
          "source_ids": [
            "src-eurosys-2023-program"
          ]
        }
      ]
    },
    {
      "author_id": null,
      "name": "Peng Huang",
      "position": 3,
      "orcid": "0000-0001-6315-0848",
      "affiliations": [
        {
          "institution_id": null,
          "name_as_published": "University of Michigan",
          "normalized_name": null,
          "institution_type": "university",
          "city": null,
          "state_or_province": null,
          "country": null,
          "region": null,
          "source_ids": [
            "src-eurosys-2023-program"
          ]
        }
      ]
    },
    {
      "author_id": null,
      "name": "Jason Nieh",
      "position": 4,
      "orcid": "0009-0005-8301-4479",
      "affiliations": [
        {
          "institution_id": null,
          "name_as_published": "Columbia University",
          "normalized_name": null,
          "institution_type": "university",
          "city": null,
          "state_or_province": null,
          "country": null,
          "region": null,
          "source_ids": [
            "src-eurosys-2023-program"
          ]
        }
      ]
    },
    {
      "author_id": null,
      "name": "Junfeng Yang",
      "position": 5,
      "orcid": "0009-0000-2277-6545",
      "affiliations": [
        {
          "institution_id": null,
          "name_as_published": "Columbia University",
          "normalized_name": null,
          "institution_type": "university",
          "city": null,
          "state_or_province": null,
          "country": null,
          "region": null,
          "source_ids": [
            "src-eurosys-2023-program"
          ]
        }
      ]
    }
  ],
  "links": {
    "doi": "10.1145/3552326.3587444",
    "official_page": "https://doi.org/10.1145/3552326.3587444",
    "official_pdf": "https://dl.acm.org/doi/pdf/10.1145/3552326.3587444",
    "artifact": null,
    "code": null,
    "project": null,
    "slides": null,
    "video": null,
    "bibtex": null
  },
  "alternate_versions": [],
  "sources": [
    {
      "id": "src-eurosys-2023-program",
      "url": "https://2023.eurosys.org/accepted-papers.html",
      "kind": "conference-program",
      "title": "EuroSys 2023 Accepted Papers",
      "publisher": "ACM SIGOPS",
      "retrieved_at": "2026-07-29T23:38:46Z",
      "content_hash": "sha256:70ac1be1448c85bc766594de9874d52a2af996fee73bf076a6c43de7fdb3a1f6",
      "official": true,
      "supports": [
        "Official 2023 main-track paper coverage, titles, author order, affiliations, sessions, and abstracts where published."
      ]
    },
    {
      "id": "src-eurosys-2023-proceedings",
      "url": "https://dl.acm.org/doi/proceedings/10.1145/3552326",
      "kind": "conference-proceedings",
      "title": "Proceedings of the Eighteenth European Conference on Computer Systems",
      "publisher": "ACM SIGOPS",
      "retrieved_at": "2026-07-29T23:38:46Z",
      "content_hash": null,
      "official": true,
      "supports": [
        "Official proceedings availability, publication venue, and publication date."
      ]
    },
    {
      "id": "src-eurosys-2023-dblp",
      "url": "https://dblp.org/db/conf/eurosys/eurosys2023.html",
      "kind": "dblp",
      "title": "DBLP table of contents for EuroSys 2023",
      "publisher": "DBLP",
      "retrieved_at": "2026-07-29T23:38:46Z",
      "content_hash": "sha256:edc45e9d2d90cfd4d3e5ea9291809fc2565b1d95dfefa7c6a507dea2b3184a44",
      "official": false,
      "supports": [
        "Fallback DOI, ORCID, and page-range metadata reconciled against the official program."
      ]
    }
  ],
  "workflow": {
    "status": "READY_FOR_REVIEW",
    "owner": "agent-a",
    "updated_at": "2026-07-29T23:38:46Z",
    "notes": [
      "Official program identity and author order were reconciled one-to-one with the complete DBLP venue table.",
      "Publication-time affiliation strings preserve the official program wording; normalized institution entities and geography remain for Agent F.",
      "Artifact, code, and project links were not exhaustively audited during program collection.",
      "The ACM PDF endpoint is derived from the verified DOI; ACM returned an automated-access response during link auditing."
    ]
  },
  "verification": {
    "collected_at": "2026-07-29T23:38:46Z",
    "last_verified_at": "2026-07-29T23:38:46Z",
    "collector_version": "agent-a-official-program-parser/1.1",
    "confidence": "HIGH",
    "verified_by": "agent-a",
    "unresolved_fields": [
      "authors[*].author_id",
      "authors[*].affiliations[*].institution_id",
      "authors[*].affiliations[*].normalized_name",
      "authors[*].affiliations[*].city",
      "authors[*].affiliations[*].state_or_province",
      "authors[*].affiliations[*].country",
      "authors[*].affiliations[*].region",
      "track_or_session",
      "links.bibtex"
    ]
  }
}
