{
  "$schema": "https://systems-phd-explorer.local/schemas/v1/paper-metadata.schema.json",
  "schema_version": "1.0.0",
  "paper_id": "ndss-2026-tickets-to-hide-an-inside-look-into-the-anti-abuse-ecosy-c3087352",
  "title": "Tickets to Hide: An Inside Look into the Anti-Abuse Ecosystem through Internal Abuse Data",
  "venue": "ndss",
  "year": 2026,
  "track_or_session": "Fall submission cycle",
  "paper_type": "main-track",
  "publication_date": "2026-02-23",
  "page_count": null,
  "venue_year_completion_status": "COMPLETE_PROCEEDINGS",
  "authors": [
    {
      "author_id": null,
      "name": "Hugo Bijmans",
      "position": 1,
      "orcid": null,
      "affiliations": [
        {
          "institution_id": null,
          "name_as_published": "Delft University of Technology",
          "normalized_name": null,
          "institution_type": "unknown",
          "city": null,
          "state_or_province": null,
          "country": null,
          "region": null,
          "source_ids": [
            "src-00bf87bf2bf27b8d-paper"
          ]
        }
      ]
    },
    {
      "author_id": null,
      "name": "Michel Van Eeten",
      "position": 2,
      "orcid": null,
      "affiliations": [
        {
          "institution_id": null,
          "name_as_published": "Delft University of Technology",
          "normalized_name": null,
          "institution_type": "unknown",
          "city": null,
          "state_or_province": null,
          "country": null,
          "region": null,
          "source_ids": [
            "src-00bf87bf2bf27b8d-paper"
          ]
        }
      ]
    },
    {
      "author_id": null,
      "name": "Rolf van Wegberg",
      "position": 3,
      "orcid": null,
      "affiliations": [
        {
          "institution_id": null,
          "name_as_published": "Delft University of Technology",
          "normalized_name": null,
          "institution_type": "unknown",
          "city": null,
          "state_or_province": null,
          "country": null,
          "region": null,
          "source_ids": [
            "src-00bf87bf2bf27b8d-paper"
          ]
        }
      ]
    }
  ],
  "links": {
    "doi": "10.14722/ndss.2026.240468",
    "official_page": "https://www.ndss-symposium.org/ndss-paper/tickets-to-hide-an-inside-look-into-the-anti-abuse-ecosystem-through-internal-abuse-data/",
    "official_pdf": "https://www.ndss-symposium.org/wp-content/uploads/2026-f468-paper.pdf",
    "artifact": null,
    "code": null,
    "project": null,
    "slides": null,
    "video": null,
    "bibtex": null
  },
  "alternate_versions": [],
  "sources": [
    {
      "id": "src-65b3321735871c7d-program",
      "url": "https://www.ndss-symposium.org/ndss2026/accepted-papers/",
      "kind": "conference-program",
      "title": "NDSS Symposium 2026 Accepted Papers",
      "publisher": "Internet Society",
      "retrieved_at": "2026-07-30T03:19:32Z",
      "content_hash": "sha256:25ea0dff73721b95ac9e129d84ccf32b245e089846426346d3a923021b12f6d9",
      "official": true,
      "supports": [
        "main-track acceptance, official title, and submission cycle"
      ]
    },
    {
      "id": "src-00bf87bf2bf27b8d-paper",
      "url": "https://www.ndss-symposium.org/ndss-paper/tickets-to-hide-an-inside-look-into-the-anti-abuse-ecosystem-through-internal-abuse-data/",
      "kind": "paper-page",
      "title": "Tickets to Hide: An Inside Look into the Anti-Abuse Ecosystem through Internal Abuse Data",
      "publisher": "Internet Society",
      "retrieved_at": "2026-07-30T03:19:32Z",
      "content_hash": "sha256:1d7c472322abe621e45ebf6542200d07b27d62be2c23012fa2bce115f81d0d4d",
      "official": true,
      "supports": [
        "published-order authors and affiliations",
        "abstract, PDF, and main-track paper identity"
      ]
    },
    {
      "id": "src-138cc0c9c8ffb29e-crossref",
      "url": "https://api.crossref.org/works/10.14722/ndss.2026.240468",
      "kind": "crossref",
      "title": "Tickets to Hide: An Inside Look into the Anti-Abuse Ecosystem through Internal Abuse Data",
      "publisher": "Crossref",
      "retrieved_at": "2026-07-30T03:19:32Z",
      "content_hash": null,
      "official": false,
      "supports": [
        "DOI and main-proceedings membership"
      ]
    },
    {
      "id": "src-12a99e5f90acc41b-dblp",
      "url": "https://dblp.org/rec/conf/ndss/BijmansEW26",
      "kind": "dblp",
      "title": "Tickets to Hide: An Inside Look into the Anti-Abuse Ecosystem through Internal Abuse Data",
      "publisher": "DBLP",
      "retrieved_at": "2026-07-30T03:19:32Z",
      "content_hash": null,
      "official": false,
      "supports": [
        "independent proceedings identity reconciliation"
      ]
    }
  ],
  "workflow": {
    "status": "READY_FOR_REVIEW",
    "owner": "agent-d",
    "updated_at": "2026-07-30T03:19:32Z",
    "notes": [
      "Canonical conference metadata was collected from the official program and paper or publisher page."
    ]
  },
  "verification": {
    "collected_at": "2026-07-30T03:19:32Z",
    "last_verified_at": "2026-07-30T03:19:32Z",
    "collector_version": "agent-d-security-collector/1.1-2026-ytd",
    "confidence": "HIGH",
    "verified_by": "agent-d",
    "unresolved_fields": [
      "page_count"
    ]
  }
}
