{
  "$schema": "https://systems-phd-explorer.local/schemas/v1/paper-metadata.schema.json",
  "schema_version": "1.0.0",
  "paper_id": "nsdi-2026-count-based-abstractions-for-performance-verification-of-db2f056b",
  "title": "Count-Based Abstractions for Performance Verification of Contention Points",
  "venue": "nsdi",
  "year": 2026,
  "track_or_session": "Trust but Verify",
  "paper_type": "main-track",
  "publication_date": null,
  "page_count": 18,
  "venue_year_completion_status": "COMPLETE_PROCEEDINGS",
  "authors": [
    {
      "author_id": null,
      "name": "Amir Seyhani",
      "position": 1,
      "orcid": null,
      "affiliations": [
        {
          "institution_id": null,
          "name_as_published": "University of Waterloo",
          "normalized_name": null,
          "institution_type": "university",
          "city": null,
          "state_or_province": null,
          "country": null,
          "region": null,
          "source_ids": [
            "src-nsdi-2026-count-based-abstractions-for-performance-verification-of-db2f056b-paper-page"
          ]
        }
      ]
    },
    {
      "author_id": null,
      "name": "Aarti Gupta",
      "position": 2,
      "orcid": null,
      "affiliations": [
        {
          "institution_id": null,
          "name_as_published": "Princeton University",
          "normalized_name": null,
          "institution_type": "university",
          "city": null,
          "state_or_province": null,
          "country": null,
          "region": null,
          "source_ids": [
            "src-nsdi-2026-count-based-abstractions-for-performance-verification-of-db2f056b-paper-page"
          ]
        }
      ]
    },
    {
      "author_id": null,
      "name": "David Walker",
      "position": 3,
      "orcid": null,
      "affiliations": [
        {
          "institution_id": null,
          "name_as_published": "Princeton University",
          "normalized_name": null,
          "institution_type": "university",
          "city": null,
          "state_or_province": null,
          "country": null,
          "region": null,
          "source_ids": [
            "src-nsdi-2026-count-based-abstractions-for-performance-verification-of-db2f056b-paper-page"
          ]
        }
      ]
    },
    {
      "author_id": null,
      "name": "Mina Tahmasbi Arashloo",
      "position": 4,
      "orcid": null,
      "affiliations": [
        {
          "institution_id": null,
          "name_as_published": "University of Waterloo",
          "normalized_name": null,
          "institution_type": "university",
          "city": null,
          "state_or_province": null,
          "country": null,
          "region": null,
          "source_ids": [
            "src-nsdi-2026-count-based-abstractions-for-performance-verification-of-db2f056b-paper-page"
          ]
        }
      ]
    }
  ],
  "links": {
    "doi": null,
    "official_page": "https://www.usenix.org/conference/nsdi26/presentation/seyhani",
    "official_pdf": "https://www.usenix.org/system/files/nsdi26-seyhani.pdf",
    "artifact": null,
    "code": null,
    "project": null,
    "slides": "https://www.usenix.org/system/files/nsdi26_slides-seyhani.pdf",
    "video": "https://www.youtube.com/embed/tIn3rUYVHSM?width%3D745%26amp%3Bheight%3D420%26amp%3Btheme%3Ddark%26amp%3Bautoplay%3D0%26amp%3Bvq%3Dhd720%26amp%3Brel%3D0%26amp%3Bshowinfo%3D0%26amp%3Bmodestbranding%3D0%26amp%3Biv_load_policy%3D1%26amp%3Bcontrols%3D1%26amp%3Bautohide%3D2%26amp%3Bwmode%3Dopaque",
    "bibtex": "@inproceedings {316704,\nauthor = {Amir Seyhani and Aarti Gupta and David Walker and Mina Tahmasbi Arashloo},\ntitle = {{Count-Based} Abstractions for Performance Verification of Contention Points},\nbooktitle = {23rd USENIX Symposium on Networked Systems Design and Implementation (NSDI 26)},\nyear = {2026},\nisbn = {978-1-939133-54-0},\naddress = {Renton, WA},\npages = {743--760},\nurl = {https://www.usenix.org/conference/nsdi26/presentation/seyhani},\npublisher = {USENIX Association},\nmonth = may\n}"
  },
  "alternate_versions": [],
  "sources": [
    {
      "id": "src-nsdi26-program",
      "url": "https://www.usenix.org/conference/nsdi26/technical-sessions",
      "kind": "conference-program",
      "title": "NSDI '26 Technical Program",
      "publisher": "USENIX Association",
      "retrieved_at": "2026-07-30T03:06:12Z",
      "content_hash": "sha256:3493b45dce6aa803009937dd54e4e8345b7fc9b4d65d2107efd898ce0667cd3c",
      "official": true,
      "supports": [
        "main-track enumeration and program-category boundaries",
        "paper titles, sessions or tracks, and displayed author affiliations"
      ]
    },
    {
      "id": "src-nsdi-2026-count-based-abstractions-for-performance-verification-of-db2f056b-paper-page",
      "url": "https://www.usenix.org/conference/nsdi26/presentation/seyhani",
      "kind": "paper-page",
      "title": "Count-Based Abstractions for Performance Verification of Contention Points",
      "publisher": "USENIX Association",
      "retrieved_at": "2026-07-30T03:09:39Z",
      "content_hash": "sha256:e6b96d0ae69a7471b28d8037cf043632d07798a2dd6d2da0e658008c0a8385e2",
      "official": true,
      "supports": [
        "canonical title and abstract",
        "ordered authors and publication-time affiliations except where the cited paper PDF resolves official-page citation metadata",
        "official paper page and PDF",
        "proceedings page range and page count",
        "official BibTeX",
        "presentation media links"
      ]
    }
  ],
  "workflow": {
    "status": "READY_FOR_REVIEW",
    "owner": "agent-b",
    "updated_at": "2026-07-30T03:19:43Z",
    "notes": [
      "Canonical identity, title, author order, and affiliations follow the checked official conference sources.",
      "No alternate version was exposed by the checked official sources; an empty alternate_versions list is not a claim that none exists elsewhere.",
      "Artifact, code, and project URLs are populated only when explicitly linked by the checked official sources; null does not assert that no external repository exists.",
      "USENIX exposes a publication year but not a day-level publication date, so publication_date remains null and conference dates stay in venue-year.json."
    ]
  },
  "verification": {
    "collected_at": "2026-07-30T03:06:12Z",
    "last_verified_at": "2026-07-30T03:19:43Z",
    "collector_version": "agent-b-2026-official-source-investigator/1.0",
    "confidence": "HIGH",
    "verified_by": "agent-b",
    "unresolved_fields": [
      "authors[].author_id",
      "authors[].orcid (not supplied by the checked official sources)",
      "authors[].affiliations[].institution_id",
      "authors[].affiliations[].normalized_name",
      "authors[].affiliations[].geography",
      "publication_date"
    ]
  }
}
