{
  "$schema": "https://systems-phd-explorer.local/schemas/v1/paper-metadata.schema.json",
  "schema_version": "1.0.0",
  "paper_id": "sp-2025-from-easy-to-hard-building-a-shortcut-for-differentially-437f9aa6",
  "title": "From Easy to Hard: Building a Shortcut for Differentially Private Image Synthesis",
  "venue": "sp",
  "year": 2025,
  "track_or_session": "Cycle 2",
  "paper_type": "main-track",
  "publication_date": "2025-05-01",
  "page_count": 19,
  "venue_year_completion_status": "COMPLETE_PROCEEDINGS",
  "authors": [
    {
      "author_id": null,
      "name": "Kecen Li",
      "position": 1,
      "orcid": null,
      "affiliations": [
        {
          "institution_id": null,
          "name_as_published": "Institute of Automation, Chinese Academy of Sciences",
          "normalized_name": null,
          "institution_type": "unknown",
          "city": null,
          "state_or_province": null,
          "country": null,
          "region": null,
          "source_ids": [
            "src-805e16312ed51f48-publisher"
          ]
        }
      ]
    },
    {
      "author_id": null,
      "name": "Chen Gong",
      "position": 2,
      "orcid": null,
      "affiliations": [
        {
          "institution_id": null,
          "name_as_published": "University of Virginia",
          "normalized_name": null,
          "institution_type": "unknown",
          "city": null,
          "state_or_province": null,
          "country": null,
          "region": null,
          "source_ids": [
            "src-805e16312ed51f48-publisher"
          ]
        }
      ]
    },
    {
      "author_id": null,
      "name": "Xiaochen Li",
      "position": 3,
      "orcid": null,
      "affiliations": [
        {
          "institution_id": null,
          "name_as_published": "University of Virginia",
          "normalized_name": null,
          "institution_type": "unknown",
          "city": null,
          "state_or_province": null,
          "country": null,
          "region": null,
          "source_ids": [
            "src-805e16312ed51f48-publisher"
          ]
        }
      ]
    },
    {
      "author_id": null,
      "name": "Yuzhong Zhao",
      "position": 4,
      "orcid": null,
      "affiliations": [
        {
          "institution_id": null,
          "name_as_published": "University of Chinese Academy of Sciences",
          "normalized_name": null,
          "institution_type": "unknown",
          "city": null,
          "state_or_province": null,
          "country": null,
          "region": null,
          "source_ids": [
            "src-805e16312ed51f48-publisher"
          ]
        }
      ]
    },
    {
      "author_id": null,
      "name": "Xinwen Hou",
      "position": 5,
      "orcid": null,
      "affiliations": [
        {
          "institution_id": null,
          "name_as_published": "Institute of Automation, Chinese Academy of Sciences",
          "normalized_name": null,
          "institution_type": "unknown",
          "city": null,
          "state_or_province": null,
          "country": null,
          "region": null,
          "source_ids": [
            "src-805e16312ed51f48-publisher"
          ]
        }
      ]
    },
    {
      "author_id": null,
      "name": "Tianhao Wang",
      "position": 6,
      "orcid": null,
      "affiliations": [
        {
          "institution_id": null,
          "name_as_published": "University of Virginia",
          "normalized_name": null,
          "institution_type": "unknown",
          "city": null,
          "state_or_province": null,
          "country": null,
          "region": null,
          "source_ids": [
            "src-805e16312ed51f48-publisher"
          ]
        }
      ]
    }
  ],
  "links": {
    "doi": "10.1109/sp61157.2025.00217",
    "official_page": "https://www.computer.org/csdl/proceedings-article/sp/2025/223600d656/26hiVDu7y5W",
    "official_pdf": "https://www.computer.org/csdl/api/v1/csdl/proceedings/download-article/26hiVDu7y5W/pdf",
    "artifact": null,
    "code": null,
    "project": null,
    "slides": null,
    "video": null,
    "bibtex": null
  },
  "alternate_versions": [],
  "sources": [
    {
      "id": "src-fc95266c1b21c26d-program",
      "url": "https://www.sp2025.ieee-security.org/accepted-papers.html",
      "kind": "conference-program",
      "title": "IEEE Symposium on Security and Privacy 2025 Accepted Papers",
      "publisher": "IEEE",
      "retrieved_at": "2026-07-29T23:46:51Z",
      "content_hash": null,
      "official": true,
      "supports": [
        "main-track acceptance, official title, and submission cycle"
      ]
    },
    {
      "id": "src-805e16312ed51f48-publisher",
      "url": "https://www.computer.org/csdl/proceedings-article/sp/2025/223600d656/26hiVDu7y5W",
      "kind": "publisher-page",
      "title": "From Easy to Hard: Building a Shortcut for Differentially Private Image Synthesis",
      "publisher": "IEEE Computer Society",
      "retrieved_at": "2026-07-29T23:46:51Z",
      "content_hash": null,
      "official": true,
      "supports": [
        "DOI, authors, affiliations, abstract, publication date, pages, and PDF"
      ]
    }
  ],
  "workflow": {
    "status": "READY_FOR_REVIEW",
    "owner": "agent-d",
    "updated_at": "2026-07-29T23:46:51Z",
    "notes": [
      "Canonical conference metadata collected from the official program and publisher or paper page."
    ]
  },
  "verification": {
    "collected_at": "2026-07-29T23:46:51Z",
    "last_verified_at": "2026-07-29T23:46:51Z",
    "collector_version": "agent-d-security-collector/1.0",
    "confidence": "HIGH",
    "verified_by": "agent-d",
    "unresolved_fields": []
  }
}
