{
  "$schema": "https://systems-phd-explorer.local/schemas/v1/paper-metadata.schema.json",
  "schema_version": "1.0.0",
  "paper_id": "usenix-security-2024-uihash-detecting-similar-android-uis-through-grid-based-1202d4e1",
  "title": "UIHash: Detecting Similar Android UIs through Grid-Based Visual Appearance Representation",
  "venue": "usenix-security",
  "year": 2024,
  "track_or_session": "Mobile Security I",
  "paper_type": "main-track",
  "publication_date": null,
  "page_count": 18,
  "venue_year_completion_status": "COMPLETE_PROCEEDINGS",
  "authors": [
    {
      "author_id": null,
      "name": "Jiawei Li",
      "position": 1,
      "orcid": null,
      "affiliations": [
        {
          "institution_id": null,
          "name_as_published": "Beihang University; National University of Singapore",
          "normalized_name": null,
          "institution_type": "unknown",
          "city": null,
          "state_or_province": null,
          "country": null,
          "region": null,
          "source_ids": [
            "src-de439b2bf6c7802b-paper"
          ]
        }
      ]
    },
    {
      "author_id": null,
      "name": "Jian Mao",
      "position": 2,
      "orcid": null,
      "affiliations": [
        {
          "institution_id": null,
          "name_as_published": "Beihang University; Tianmushan Laboratory; Hangzhou Innovation Institute, Beihang University",
          "normalized_name": null,
          "institution_type": "unknown",
          "city": null,
          "state_or_province": null,
          "country": null,
          "region": null,
          "source_ids": [
            "src-de439b2bf6c7802b-paper"
          ]
        }
      ]
    },
    {
      "author_id": null,
      "name": "Jun Zeng",
      "position": 3,
      "orcid": null,
      "affiliations": [
        {
          "institution_id": null,
          "name_as_published": "National University of Singapore",
          "normalized_name": null,
          "institution_type": "unknown",
          "city": null,
          "state_or_province": null,
          "country": null,
          "region": null,
          "source_ids": [
            "src-de439b2bf6c7802b-paper"
          ]
        }
      ]
    },
    {
      "author_id": null,
      "name": "Qixiao Lin",
      "position": 4,
      "orcid": null,
      "affiliations": [
        {
          "institution_id": null,
          "name_as_published": "Beihang University",
          "normalized_name": null,
          "institution_type": "unknown",
          "city": null,
          "state_or_province": null,
          "country": null,
          "region": null,
          "source_ids": [
            "src-de439b2bf6c7802b-paper"
          ]
        }
      ]
    },
    {
      "author_id": null,
      "name": "Shaowen Feng",
      "position": 5,
      "orcid": null,
      "affiliations": [
        {
          "institution_id": null,
          "name_as_published": "Beihang University",
          "normalized_name": null,
          "institution_type": "unknown",
          "city": null,
          "state_or_province": null,
          "country": null,
          "region": null,
          "source_ids": [
            "src-de439b2bf6c7802b-paper"
          ]
        }
      ]
    },
    {
      "author_id": null,
      "name": "Zhenkai Liang",
      "position": 6,
      "orcid": null,
      "affiliations": [
        {
          "institution_id": null,
          "name_as_published": "National University of Singapore",
          "normalized_name": null,
          "institution_type": "unknown",
          "city": null,
          "state_or_province": null,
          "country": null,
          "region": null,
          "source_ids": [
            "src-de439b2bf6c7802b-paper"
          ]
        }
      ]
    }
  ],
  "links": {
    "doi": null,
    "official_page": "https://www.usenix.org/conference/usenixsecurity24/presentation/li-jiawei",
    "official_pdf": "https://www.usenix.org/system/files/usenixsecurity24-li-jiawei.pdf",
    "artifact": null,
    "code": null,
    "project": null,
    "slides": "https://www.usenix.org/system/files/usenixsecurity24_slides-li-jiawei.pdf",
    "video": null,
    "bibtex": "@inproceedings {298076,\nauthor = {Jiawei Li and Jian Mao and Jun Zeng and Qixiao Lin and Shaowen Feng and Zhenkai Liang},\ntitle = {{UIHash}: Detecting Similar Android {UIs} through {Grid-Based} Visual Appearance Representation},\nbooktitle = {33rd USENIX Security Symposium (USENIX Security 24)},\nyear = {2024},\nisbn = {978-1-939133-44-1},\naddress = {Philadelphia, PA},\npages = {665--682},\nurl = {https://www.usenix.org/conference/usenixsecurity24/presentation/li-jiawei},\npublisher = {USENIX Association},\nmonth = aug\n}"
  },
  "alternate_versions": [],
  "sources": [
    {
      "id": "src-78e19acef3d415b1-program",
      "url": "https://www.usenix.org/conference/usenixsecurity24/technical-sessions",
      "kind": "conference-program",
      "title": "USENIX Security 2024 Technical Sessions",
      "publisher": "USENIX Association",
      "retrieved_at": "2026-07-30T00:17:50Z",
      "content_hash": null,
      "official": true,
      "supports": [
        "main-track program membership and session"
      ]
    },
    {
      "id": "src-de439b2bf6c7802b-paper",
      "url": "https://www.usenix.org/conference/usenixsecurity24/presentation/li-jiawei",
      "kind": "paper-page",
      "title": "UIHash: Detecting Similar Android UIs through Grid-Based Visual Appearance Representation",
      "publisher": "USENIX Association",
      "retrieved_at": "2026-07-30T00:17:50Z",
      "content_hash": null,
      "official": true,
      "supports": [
        "authors, affiliations, abstract, page span, PDF, and BibTeX when exposed"
      ]
    }
  ],
  "workflow": {
    "status": "READY_FOR_REVIEW",
    "owner": "agent-d",
    "updated_at": "2026-07-30T00:17:50Z",
    "notes": [
      "Canonical conference metadata collected from the official program and publisher or paper page."
    ]
  },
  "verification": {
    "collected_at": "2026-07-30T00:17:50Z",
    "last_verified_at": "2026-07-30T00:17:50Z",
    "collector_version": "agent-d-security-collector/1.1",
    "confidence": "MEDIUM",
    "verified_by": "agent-d",
    "unresolved_fields": [
      "publication_date"
    ]
  }
}
