{
  "$schema": "https://systems-phd-explorer.local/schemas/v1/paper-metadata.schema.json",
  "schema_version": "1.0.0",
  "paper_id": "nsdi-2025-mowgli-passively-learned-rate-control-for-real-time-vide-218cd863",
  "title": "Mowgli: Passively Learned Rate Control for Real-Time Video",
  "venue": "nsdi",
  "year": 2025,
  "track_or_session": "Video and Cloud Gaming",
  "paper_type": "main-track",
  "publication_date": null,
  "page_count": 16,
  "venue_year_completion_status": "COMPLETE_PROCEEDINGS",
  "authors": [
    {
      "author_id": null,
      "name": "Neil Agarwal",
      "position": 1,
      "orcid": null,
      "affiliations": [
        {
          "institution_id": null,
          "name_as_published": "Princeton University",
          "normalized_name": null,
          "institution_type": "university",
          "city": null,
          "state_or_province": null,
          "country": null,
          "region": null,
          "source_ids": [
            "src-nsdi-2025-mowgli-passively-learned-rate-control-for-real-time-vide-218cd863-paper-page"
          ]
        }
      ]
    },
    {
      "author_id": null,
      "name": "Rui Pan",
      "position": 2,
      "orcid": null,
      "affiliations": [
        {
          "institution_id": null,
          "name_as_published": "Princeton University",
          "normalized_name": null,
          "institution_type": "university",
          "city": null,
          "state_or_province": null,
          "country": null,
          "region": null,
          "source_ids": [
            "src-nsdi-2025-mowgli-passively-learned-rate-control-for-real-time-vide-218cd863-paper-page"
          ]
        }
      ]
    },
    {
      "author_id": null,
      "name": "Francis Y. Yan",
      "position": 3,
      "orcid": null,
      "affiliations": [
        {
          "institution_id": null,
          "name_as_published": "University of Illinois Urbana-Champaign",
          "normalized_name": null,
          "institution_type": "university",
          "city": null,
          "state_or_province": null,
          "country": null,
          "region": null,
          "source_ids": [
            "src-nsdi-2025-mowgli-passively-learned-rate-control-for-real-time-vide-218cd863-paper-page"
          ]
        }
      ]
    },
    {
      "author_id": null,
      "name": "Ravi Netravali",
      "position": 4,
      "orcid": null,
      "affiliations": [
        {
          "institution_id": null,
          "name_as_published": "Princeton University",
          "normalized_name": null,
          "institution_type": "university",
          "city": null,
          "state_or_province": null,
          "country": null,
          "region": null,
          "source_ids": [
            "src-nsdi-2025-mowgli-passively-learned-rate-control-for-real-time-vide-218cd863-paper-page"
          ]
        }
      ]
    }
  ],
  "links": {
    "doi": null,
    "official_page": "https://www.usenix.org/conference/nsdi25/presentation/agarwal",
    "official_pdf": "https://www.usenix.org/system/files/nsdi25-agarwal.pdf",
    "artifact": null,
    "code": null,
    "project": null,
    "slides": null,
    "video": "https://www.youtube.com/embed/cZLwvoCfo0I?width%3D745%26amp%3Bheight%3D420%26amp%3Btheme%3Ddark%26amp%3Bautoplay%3D0%26amp%3Bvq%3Dhd720%26amp%3Brel%3D0%26amp%3Bshowinfo%3D0%26amp%3Bmodestbranding%3D0%26amp%3Biv_load_policy%3D1%26amp%3Bcontrols%3D1%26amp%3Bautohide%3D2%26amp%3Bwmode%3Dopaque",
    "bibtex": "@inproceedings {306039,\nauthor = {Neil Agarwal and Rui Pan and Francis Y. Yan and Ravi Netravali},\ntitle = {Mowgli: Passively Learned Rate Control for {Real-Time} Video},\nbooktitle = {22nd USENIX Symposium on Networked Systems Design and Implementation (NSDI 25)},\nyear = {2025},\nisbn = {978-1-939133-46-5},\naddress = {Philadelphia, PA},\npages = {579--594},\nurl = {https://www.usenix.org/conference/nsdi25/presentation/agarwal},\npublisher = {USENIX Association},\nmonth = apr\n}"
  },
  "alternate_versions": [],
  "sources": [
    {
      "id": "src-nsdi25-program",
      "url": "https://www.usenix.org/conference/nsdi25/technical-sessions",
      "kind": "conference-program",
      "title": "NSDI '25 Technical Sessions",
      "publisher": "USENIX Association",
      "retrieved_at": "2026-07-29T23:13:34Z",
      "content_hash": "sha256:5190c4bfe0795a131e0d38ceda8da95de909a27d468766c5128a668aab4fceb6",
      "official": true,
      "supports": [
        "conference dates and technical-session structure",
        "complete accepted-paper enumeration and non-paper boundaries",
        "paper titles, sessions, abstracts, and displayed author affiliations"
      ]
    },
    {
      "id": "src-nsdi-2025-mowgli-passively-learned-rate-control-for-real-time-vide-218cd863-paper-page",
      "url": "https://www.usenix.org/conference/nsdi25/presentation/agarwal",
      "kind": "paper-page",
      "title": "Mowgli: Passively Learned Rate Control for Real-Time Video",
      "publisher": "USENIX Association",
      "retrieved_at": "2026-07-29T23:13:34Z",
      "content_hash": "sha256:bb66ec676725366c92372185585d8ba49b90ea242d6a2d9ff12b8f7a51666bee",
      "official": true,
      "supports": [
        "canonical title and abstract",
        "ordered authors and publication-time affiliations",
        "official paper page and PDF",
        "proceedings page range",
        "official BibTeX",
        "presentation media links"
      ]
    }
  ],
  "workflow": {
    "status": "READY_FOR_REVIEW",
    "owner": "agent-b",
    "updated_at": "2026-07-29T23:13:34Z",
    "notes": [
      "Canonical identity and author order follow official venue sources; lower-priority metadata never overrides them.",
      "Official program titles were reconciled against the paper-page or Crossref title; no unresolved title variant remains.",
      "No alternate version was exposed by the official page links or Crossref relation metadata checked for this record.",
      "Artifact, code, and project URLs are populated only when explicitly linked by the checked official pages; null does not assert that no external repository exists.",
      "USENIX exposes a publication year but not a day-level publication date, so publication_date remains unresolved and conference dates stay in venue-year.json."
    ]
  },
  "verification": {
    "collected_at": "2026-07-29T22:42:31Z",
    "last_verified_at": "2026-07-29T23:13:34Z",
    "collector_version": "agent-b-official-program-collector/1.0",
    "confidence": "HIGH",
    "verified_by": "agent-b",
    "unresolved_fields": [
      "authors[].author_id",
      "authors[].affiliations[].institution_id",
      "authors[].affiliations[].normalized_name",
      "authors[].affiliations[].geography",
      "authors[].orcid (not available for every author)",
      "publication_date"
    ]
  }
}
