{
  "$schema": "https://systems-phd-explorer.local/schemas/v1/paper-metadata.schema.json",
  "schema_version": "1.0.0",
  "paper_id": "ccs-2025-virtual-reality-real-problems-a-longitudinal-security-an-1b065829",
  "title": "Virtual Reality, Real Problems: A Longitudinal Security Analysis of VR Firmware",
  "venue": "ccs",
  "year": 2025,
  "track_or_session": "Cycle 2",
  "paper_type": "main-track",
  "publication_date": "2025-11-22",
  "page_count": 15,
  "venue_year_completion_status": "COMPLETE_PROCEEDINGS",
  "authors": [
    {
      "author_id": null,
      "name": "Vamsi Shankar Simhadri",
      "position": 1,
      "orcid": "0009-0003-0482-6010",
      "affiliations": [
        {
          "institution_id": null,
          "name_as_published": "Department of Computer Science, George Mason University, Fairfax, VA, USA",
          "normalized_name": null,
          "institution_type": "unknown",
          "city": null,
          "state_or_province": null,
          "country": null,
          "region": null,
          "source_ids": [
            "src-cc95c8ff9055391f-crossref"
          ]
        }
      ]
    },
    {
      "author_id": null,
      "name": "Yichang Xiong",
      "position": 2,
      "orcid": "0009-0004-2680-0302",
      "affiliations": [
        {
          "institution_id": null,
          "name_as_published": "Department of Computer Science, George Mason University, Fairfax, VA, USA",
          "normalized_name": null,
          "institution_type": "unknown",
          "city": null,
          "state_or_province": null,
          "country": null,
          "region": null,
          "source_ids": [
            "src-cc95c8ff9055391f-crossref"
          ]
        }
      ]
    },
    {
      "author_id": null,
      "name": "Habiba Farrukh",
      "position": 3,
      "orcid": "0000-0002-3582-5999",
      "affiliations": [
        {
          "institution_id": null,
          "name_as_published": "Department of Computer Science, University of California, Irvine, Irvine, CA, USA",
          "normalized_name": null,
          "institution_type": "unknown",
          "city": null,
          "state_or_province": null,
          "country": null,
          "region": null,
          "source_ids": [
            "src-cc95c8ff9055391f-crossref"
          ]
        }
      ]
    },
    {
      "author_id": null,
      "name": "Xiaokuan Zhang",
      "position": 4,
      "orcid": "0000-0002-4646-7146",
      "affiliations": [
        {
          "institution_id": null,
          "name_as_published": "Department of Computer Science, George Mason University, Fairfax, VA, USA",
          "normalized_name": null,
          "institution_type": "unknown",
          "city": null,
          "state_or_province": null,
          "country": null,
          "region": null,
          "source_ids": [
            "src-cc95c8ff9055391f-crossref"
          ]
        }
      ]
    }
  ],
  "links": {
    "doi": "10.1145/3719027.3765102",
    "official_page": "https://dl.acm.org/doi/10.1145/3719027.3765102",
    "official_pdf": "https://dl.acm.org/doi/pdf/10.1145/3719027.3765102",
    "artifact": null,
    "code": null,
    "project": null,
    "slides": null,
    "video": null,
    "bibtex": null
  },
  "alternate_versions": [],
  "sources": [
    {
      "id": "src-a6f96ba67a6c6374-program",
      "url": "https://www.sigsac.org/ccs/CCS2025/assets/accepted-papers.json",
      "kind": "conference-program",
      "title": "ACM CCS 2025 accepted papers",
      "publisher": "ACM SIGSAC",
      "retrieved_at": "2026-07-29T23:46:51Z",
      "content_hash": null,
      "official": true,
      "supports": [
        "main-track acceptance and submission cycle"
      ]
    },
    {
      "id": "src-b1d0b596cc99443b-publisher",
      "url": "https://dl.acm.org/doi/10.1145/3719027.3765102",
      "kind": "publisher-page",
      "title": "Virtual Reality, Real Problems: A Longitudinal Security Analysis of VR Firmware",
      "publisher": "Association for Computing Machinery",
      "retrieved_at": "2026-07-29T23:46:51Z",
      "content_hash": null,
      "official": true,
      "supports": [
        "canonical paper page, DOI, and PDF link"
      ]
    },
    {
      "id": "src-cc95c8ff9055391f-crossref",
      "url": "https://api.crossref.org/works/10.1145/3719027.3765102",
      "kind": "crossref",
      "title": "Virtual Reality, Real Problems: A Longitudinal Security Analysis of VR Firmware",
      "publisher": "Crossref",
      "retrieved_at": "2026-07-29T23:46:51Z",
      "content_hash": null,
      "official": false,
      "supports": [
        "published-order authors",
        "publication-time affiliations",
        "publication date and page span"
      ]
    }
  ],
  "workflow": {
    "status": "READY_FOR_REVIEW",
    "owner": "agent-d",
    "updated_at": "2026-07-29T23:46:51Z",
    "notes": [
      "Canonical conference metadata collected from the official program and publisher or paper page."
    ]
  },
  "verification": {
    "collected_at": "2026-07-29T23:46:51Z",
    "last_verified_at": "2026-07-29T23:46:51Z",
    "collector_version": "agent-d-security-collector/1.0",
    "confidence": "HIGH",
    "verified_by": "agent-d",
    "unresolved_fields": []
  }
}
