{
  "$schema": "https://systems-phd-explorer.local/schemas/v1/paper-metadata.schema.json",
  "schema_version": "1.0.0",
  "paper_id": "usenix-security-2024-pixelmod-improving-soft-moderation-of-visual-misleading-3b0663d2",
  "title": "PIXELMOD: Improving Soft Moderation of Visual Misleading Information on Twitter",
  "venue": "usenix-security",
  "year": 2024,
  "track_or_session": "Measurement V: App",
  "paper_type": "main-track",
  "publication_date": null,
  "page_count": 18,
  "venue_year_completion_status": "COMPLETE_PROCEEDINGS",
  "authors": [
    {
      "author_id": null,
      "name": "Pujan Paudel",
      "position": 1,
      "orcid": null,
      "affiliations": [
        {
          "institution_id": null,
          "name_as_published": "Boston University",
          "normalized_name": null,
          "institution_type": "unknown",
          "city": null,
          "state_or_province": null,
          "country": null,
          "region": null,
          "source_ids": [
            "src-d4270194eba827a8-paper"
          ]
        }
      ]
    },
    {
      "author_id": null,
      "name": "Chen Ling",
      "position": 2,
      "orcid": null,
      "affiliations": [
        {
          "institution_id": null,
          "name_as_published": "Boston University",
          "normalized_name": null,
          "institution_type": "unknown",
          "city": null,
          "state_or_province": null,
          "country": null,
          "region": null,
          "source_ids": [
            "src-d4270194eba827a8-paper"
          ]
        }
      ]
    },
    {
      "author_id": null,
      "name": "Jeremy Blackburn",
      "position": 3,
      "orcid": null,
      "affiliations": [
        {
          "institution_id": null,
          "name_as_published": "Binghamton University",
          "normalized_name": null,
          "institution_type": "unknown",
          "city": null,
          "state_or_province": null,
          "country": null,
          "region": null,
          "source_ids": [
            "src-d4270194eba827a8-paper"
          ]
        }
      ]
    },
    {
      "author_id": null,
      "name": "Gianluca Stringhini",
      "position": 4,
      "orcid": null,
      "affiliations": [
        {
          "institution_id": null,
          "name_as_published": "Boston University",
          "normalized_name": null,
          "institution_type": "unknown",
          "city": null,
          "state_or_province": null,
          "country": null,
          "region": null,
          "source_ids": [
            "src-d4270194eba827a8-paper"
          ]
        }
      ]
    }
  ],
  "links": {
    "doi": null,
    "official_page": "https://www.usenix.org/conference/usenixsecurity24/presentation/paudel-pixelmod",
    "official_pdf": "https://www.usenix.org/system/files/usenixsecurity24-paudel-pixelmod.pdf",
    "artifact": null,
    "code": null,
    "project": null,
    "slides": null,
    "video": null,
    "bibtex": "@inproceedings {298244,\nauthor = {Pujan Paudel and Chen Ling and Jeremy Blackburn and Gianluca Stringhini},\ntitle = {{PIXELMOD}: Improving Soft Moderation of Visual Misleading Information on Twitter},\nbooktitle = {33rd USENIX Security Symposium (USENIX Security 24)},\nyear = {2024},\nisbn = {978-1-939133-44-1},\naddress = {Philadelphia, PA},\npages = {5125--5142},\nurl = {https://www.usenix.org/conference/usenixsecurity24/presentation/paudel-pixelmod},\npublisher = {USENIX Association},\nmonth = aug\n}"
  },
  "alternate_versions": [],
  "sources": [
    {
      "id": "src-f2672d844d0dbe17-program",
      "url": "https://www.usenix.org/conference/usenixsecurity24/technical-sessions",
      "kind": "conference-program",
      "title": "USENIX Security 2024 Technical Sessions",
      "publisher": "USENIX Association",
      "retrieved_at": "2026-07-30T00:17:50Z",
      "content_hash": null,
      "official": true,
      "supports": [
        "main-track program membership and session"
      ]
    },
    {
      "id": "src-d4270194eba827a8-paper",
      "url": "https://www.usenix.org/conference/usenixsecurity24/presentation/paudel-pixelmod",
      "kind": "paper-page",
      "title": "PIXELMOD: Improving Soft Moderation of Visual Misleading Information on Twitter",
      "publisher": "USENIX Association",
      "retrieved_at": "2026-07-30T00:17:50Z",
      "content_hash": null,
      "official": true,
      "supports": [
        "authors, affiliations, abstract, page span, PDF, and BibTeX when exposed"
      ]
    }
  ],
  "workflow": {
    "status": "READY_FOR_REVIEW",
    "owner": "agent-d",
    "updated_at": "2026-07-30T00:17:50Z",
    "notes": [
      "Canonical conference metadata collected from the official program and publisher or paper page."
    ]
  },
  "verification": {
    "collected_at": "2026-07-30T00:17:50Z",
    "last_verified_at": "2026-07-30T00:17:50Z",
    "collector_version": "agent-d-security-collector/1.1",
    "confidence": "MEDIUM",
    "verified_by": "agent-d",
    "unresolved_fields": [
      "publication_date"
    ]
  }
}
