{
  "$schema": "https://systems-phd-explorer.local/schemas/v1/paper-metadata.schema.json",
  "schema_version": "1.0.0",
  "paper_id": "sp-2023-analyzing-leakage-of-personally-identifiable-information-09894ee4",
  "title": "Analyzing Leakage of Personally Identifiable Information in Language Models",
  "venue": "sp",
  "year": 2023,
  "track_or_session": "Session 2B: Machine learning privacy",
  "paper_type": "main-track",
  "publication_date": "2023-05-01",
  "page_count": 18,
  "venue_year_completion_status": "COMPLETE_PROCEEDINGS",
  "authors": [
    {
      "author_id": null,
      "name": "Nils Lukas",
      "position": 1,
      "orcid": null,
      "affiliations": [
        {
          "institution_id": null,
          "name_as_published": "University of Waterloo",
          "normalized_name": null,
          "institution_type": "unknown",
          "city": null,
          "state_or_province": null,
          "country": null,
          "region": null,
          "source_ids": [
            "src-ea120839c24cf91e-schedule"
          ]
        }
      ]
    },
    {
      "author_id": null,
      "name": "Ahmed Salem",
      "position": 2,
      "orcid": null,
      "affiliations": [
        {
          "institution_id": null,
          "name_as_published": "Microsoft Research",
          "normalized_name": null,
          "institution_type": "unknown",
          "city": null,
          "state_or_province": null,
          "country": null,
          "region": null,
          "source_ids": [
            "src-ea120839c24cf91e-schedule"
          ]
        }
      ]
    },
    {
      "author_id": null,
      "name": "Robert Sim",
      "position": 3,
      "orcid": null,
      "affiliations": [
        {
          "institution_id": null,
          "name_as_published": "Microsoft Research",
          "normalized_name": null,
          "institution_type": "unknown",
          "city": null,
          "state_or_province": null,
          "country": null,
          "region": null,
          "source_ids": [
            "src-ea120839c24cf91e-schedule"
          ]
        }
      ]
    },
    {
      "author_id": null,
      "name": "Shruti Tople",
      "position": 4,
      "orcid": null,
      "affiliations": [
        {
          "institution_id": null,
          "name_as_published": "Microsoft Research",
          "normalized_name": null,
          "institution_type": "unknown",
          "city": null,
          "state_or_province": null,
          "country": null,
          "region": null,
          "source_ids": [
            "src-ea120839c24cf91e-schedule"
          ]
        }
      ]
    },
    {
      "author_id": null,
      "name": "Lukas Wutschitz",
      "position": 5,
      "orcid": null,
      "affiliations": [
        {
          "institution_id": null,
          "name_as_published": "Microsoft Research",
          "normalized_name": null,
          "institution_type": "unknown",
          "city": null,
          "state_or_province": null,
          "country": null,
          "region": null,
          "source_ids": [
            "src-ea120839c24cf91e-schedule"
          ]
        }
      ]
    },
    {
      "author_id": null,
      "name": "Santiago Zanella-Béguelin",
      "position": 6,
      "orcid": null,
      "affiliations": [
        {
          "institution_id": null,
          "name_as_published": "Microsoft Research",
          "normalized_name": null,
          "institution_type": "unknown",
          "city": null,
          "state_or_province": null,
          "country": null,
          "region": null,
          "source_ids": [
            "src-ea120839c24cf91e-schedule"
          ]
        }
      ]
    }
  ],
  "links": {
    "doi": "10.1109/sp46215.2023.10179300",
    "official_page": "https://doi.org/10.1109/SP46215.2023.10179300",
    "official_pdf": "http://xplorestaging.ieee.org/ielx7/10179215/10179280/10179300.pdf?arnumber=10179300",
    "artifact": null,
    "code": null,
    "project": null,
    "slides": null,
    "video": null,
    "bibtex": null
  },
  "alternate_versions": [],
  "sources": [
    {
      "id": "src-575972526c84dee4-program",
      "url": "https://www.ieee-security.org/TC/SP2023/program-papers.html",
      "kind": "conference-program",
      "title": "IEEE Symposium on Security and Privacy 2023 Accepted Papers",
      "publisher": "IEEE",
      "retrieved_at": "2026-07-30T01:39:19Z",
      "content_hash": null,
      "official": true,
      "supports": [
        "main-track acceptance and official accepted title"
      ]
    },
    {
      "id": "src-ea120839c24cf91e-schedule",
      "url": "https://www.ieee-security.org/TC/SP2023/program.html",
      "kind": "conference-program",
      "title": "IEEE Symposium on Security and Privacy 2023 Program",
      "publisher": "IEEE",
      "retrieved_at": "2026-07-30T01:39:19Z",
      "content_hash": null,
      "official": true,
      "supports": [
        "session, authors, and affiliations"
      ]
    },
    {
      "id": "src-59ef222163e180ee-publisher",
      "url": "https://doi.org/10.1109/SP46215.2023.10179300",
      "kind": "publisher-page",
      "title": "Analyzing Leakage of Personally Identifiable Information in Language Models",
      "publisher": "IEEE Computer Society",
      "retrieved_at": "2026-07-30T01:39:19Z",
      "content_hash": null,
      "official": true,
      "supports": [
        "DOI and canonical publisher record"
      ]
    },
    {
      "id": "src-5501b24b0b0b4219-crossref",
      "url": "https://api.crossref.org/works/10.1109/sp46215.2023.10179300",
      "kind": "crossref",
      "title": "Analyzing Leakage of Personally Identifiable Information in Language Models",
      "publisher": "Crossref",
      "retrieved_at": "2026-07-30T01:39:19Z",
      "content_hash": null,
      "official": false,
      "supports": [
        "publication date, page span, and official PDF link"
      ]
    },
    {
      "id": "src-cad55d9886e03fc7-abstract",
      "url": "https://openalex.org/W4385679821",
      "kind": "openalex",
      "title": "Analyzing Leakage of Personally Identifiable Information in Language Models",
      "publisher": "OpenAlex",
      "retrieved_at": "2026-07-30T01:39:19Z",
      "content_hash": null,
      "official": false,
      "supports": [
        "abstract used for relevance screening"
      ]
    }
  ],
  "workflow": {
    "status": "READY_FOR_REVIEW",
    "owner": "agent-d",
    "updated_at": "2026-07-30T01:39:19Z",
    "notes": [
      "Canonical conference metadata collected from the official program and publisher or paper page."
    ]
  },
  "verification": {
    "collected_at": "2026-07-30T01:39:19Z",
    "last_verified_at": "2026-07-30T01:39:19Z",
    "collector_version": "agent-d-security-collector/1.2",
    "confidence": "HIGH",
    "verified_by": "agent-d",
    "unresolved_fields": []
  }
}
